ID,Name,Address,City,State,Zip,Phone,Email,Website,Latitude,Longitude,Description,Rating,ReviewCount,VanTypes,PriceMin,PriceMax,Amenities,Services,Certifications,YearsInBusiness,LeadTime
ca-1,Adventure Wagon,123 Adventure Way,San Diego,CA,92101,(555) 111-2222,info@adventurewagon.com,https://adventurewagon.com,32.7157,-117.1611,"Specializes in custom van conversions, including Mercedes Sprinter, Ford Transit, and Ram ProMaster, with a focus on adventure and outdoor enthusiasts.",4.8,105,"Sprinter,Transit,ProMaster",40000,120000,"Solar Power,Kitchen,Bathroom,Heating,Off-Grid Systems,Outdoor Shower","Custom Builds,Adventure Outfitting,Electrical,Plumbing","RVIA Certified,ASE Certified",7,4-8 months
ca-2,California Van Conversions,456 Sunset Blvd,Los Angeles,CA,90028,(555) 222-3333,info@calvanconversions.com,https://calvanconversions.com,34.0522,-118.2437,"Offers custom van conversions, including camper vans, wheelchair-accessible vehicles, and commercial vans.",4.6,92,"Sprinter,Transit,ProMaster",35000,110000,"Solar Power,Kitchen,Bathroom,Heating,Air Conditioning","Custom Builds,Commercial Upfitting,Electrical,Plumbing,Accessibility Modifications","RVIA Certified,ADA Compliant",9,3-7 months
ca-3,Sportsmobile,789 Sportsmobile Way,Fresno,CA,93721,(555) 333-4444,info@sportsmobile.com,https://sportsmobile.com,36.7378,-119.7871,"Provides custom van conversions, including luxury vans, wheelchair-accessible vehicles, and commercial vans.",4.9,138,"Sprinter,Transit,ProMaster,E-Series",45000,150000,"Solar Power,Kitchen,Bathroom,Heating,Air Conditioning,Off-Road Capabilities","Custom Builds,Off-Road Outfitting,Electrical,Plumbing,Mechanical Work","RVIA Certified,ASE Certified",25,4-10 months
ca-4,VanDoIt,101 Tech Drive,San Jose,CA,95110,(555) 444-5555,info@vandoit.com,https://vandoit.com,37.3382,-121.8863,"Specializes in custom van conversions, including Mercedes Sprinter, Ford Transit, and Ram ProMaster.",4.7,85,"Sprinter,Transit,ProMaster",38000,115000,"Solar Power,Kitchen,Bathroom,Heating,Smart Systems","Custom Builds,Electrical,Plumbing,Smart Home Integration","RVIA Certified",6,3-6 months
ca-5,VanCraft California,202 Capital Ave,Sacramento,CA,95814,(555) 555-6666,info@vancraftca.com,https://vancraftca.com,38.5816,-121.4944,"Specializes in custom van conversions, including Mercedes Sprinter, Ford Transit, and Ram ProMaster, with a focus on luxury and adventure vans.",4.8,97,"Sprinter,Transit,ProMaster",42000,135000,"Solar Power,Kitchen,Bathroom,Heating,Air Conditioning,Luxury Finishes","Custom Builds,Luxury Interiors,Electrical,Plumbing,Adventure Outfitting","RVIA Certified,ASE Certified",8,4-9 months
